{
  "schema_version": 1,
  "id": "floquet-ising-51q",
  "title": "Floquet-Ising oscillation detection on 51 qubits",
  "short_title": "Floquet-Ising 51q",
  "evidence_date": "2026-08-08",
  "summary": "A complete 51-qubit IBM Fez PEA/ZNE trajectory detected a reproducible Floquet-Ising oscillation in less declared execution time than a local D=64 PEPS simple-update trajectory for the same coordination-two magnetization.",
  "scale": {
    "qubits": 51,
    "sites": null
  },
  "quantum": {
    "backend": "IBM Fez",
    "task": "Obtain and detect the oscillatory coordination-two magnetization trajectory for the fixed 51-qubit circuit over 16 Floquet cycles",
    "workflow": "Estimator PEA/ZNE with three controlled noise factors, 1,024 shots per factor, fresh layer-noise learning, and the fixed physical layout",
    "timings": [
      {
        "seconds": 41,
        "scope": "QPU execution time for the complete PEA/ZNE route; excludes queueing, orchestration, retrieval, analysis, and classical mitigation processing",
        "primary": true
      }
    ],
    "result_summary": "The fitted PEA/ZNE period was 4.76 cycles with profile interval 4.62 to 4.92; the fitted oscillation amplitude was about 5.2 conditional fit standard errors, consistent with two independent raw plus M3 trajectories at periods 4.48 and 4.61."
  },
  "classical_baselines": [
    {
      "method": "Local Quimb arbitrary-geometry PEPS simple update at D=64",
      "seconds": 366.1695447070015,
      "scope": "Local wall time for the same 51-qubit circuit, 16 cycles, and coordination-two magnetization trajectory",
      "status": "complete; D=40-to-D=64 convergence accepted through cycle 8 only, with cycles 9-16 diagnostic rather than converged"
    },
    {
      "method": "Local Quimb arbitrary-geometry PEPS simple update at D=40",
      "seconds": 118.33,
      "scope": "Supporting lower-bond full trajectory for the same circuit and observable",
      "status": "complete; used with D=64 to define the low-D convergence window"
    },
    {
      "method": "Published PEPS-BP production calculations at D=512 and D=700",
      "seconds": null,
      "scope": "Paper-reported high-bond classical route on substantially larger CPU and memory resources, not reproduced by this local project",
      "status": "paper baseline; 35.1 hours at D=512 and 599.8 hours at D=700, with late-cycle convergence limitations"
    }
  ],
  "comparison": {
    "classification": "local_time_to_answer",
    "headline": "The 41-QPU-second PEA/ZNE route detected the 51-qubit oscillation 8.93x sooner than the 366.17-second local D=64 PEPS-SU trajectory under the declared timing scopes.",
    "ratio": 8.930964505048816,
    "ratio_is_lower_bound": false,
    "scope": "This is a task-specific time-to-qualitative-signal comparison between QPU execution time and local PEPS wall time for the same circuit and observable; it excludes cloud workflow overhead and does not assert matched numerical accuracy.",
    "label": "Partial task-specific time-to-signal advantage of 8.93x; accuracy is not matched"
  },
  "official_sources": [
    {
      "label": "Leviatan et al., Quantum Simulations beyond Classical Capabilities with Error-Mitigated Dynamic Circuits",
      "url": "https://arxiv.org/abs/2607.24937",
      "type": "paper"
    },
    {
      "label": "Quantum Advantage Tracker repository",
      "url": "https://github.com/quantum-advantage-tracker/quantum-advantage-tracker.github.io",
      "type": "tracker"
    }
  ],
  "implementation": {
    "edukaizen_url": "https://edukaizen.nl/floquet-ising-toy-model/",
    "github_repositories": [
      "https://github.com/BramDo/FLOQUET-QEM"
    ],
    "key_articles": [
      "https://edukaizen.nl/floquet-ising-toy-model/van-toy-model-naar-51-qubits/"
    ]
  },
  "claim_boundary": [
    "This is a partial, task-specific practical time-to-signal advantage, not a general or complexity-theoretic quantum-advantage claim.",
    "The 41-second timing is QPU execution only and excludes queueing, orchestration, retrieval, analysis, and classical mitigation processing.",
    "The classical D=64 PEPS-SU trajectory is converged by the declared low-D diagnostic only through cycle 8; cycles 9-16 are not a claim-ready classical reference.",
    "Across the eight trusted cycles, PEA/ZNE has diagnostic SRMSE 3.154 and maximum absolute z-score 6.932, so the preregistered matched-accuracy thresholds are not met.",
    "The local PEPS-SU implementation is not the paper's PEPS-BP production method at D=512 and D=700, and a stronger observable-specific classical result may change the ranking."
  ],
  "tags": [
    "floquet-ising",
    "many-body",
    "pea-zne",
    "tensor-networks",
    "51-qubits",
    "time-to-signal"
  ]
}
