{
  "schema_version": 1,
  "id": "xxzham-80q",
  "title": "XXZham: imbalance dynamics of 80 spins",
  "short_title": "XXZham",
  "evidence_date": "2026-09-27",
  "summary": "An IBM Kingston Heron R2 run returned the full 31-point imbalance curve for an 80-spin XXZ chain in 76 registered QPU seconds. Local chi=64, chi=128, chi=256 and chi=512 TEBD runs at dt=1/24 took 130.69 s, 1,503.99 s, 4,571.54 s and 35,432.31 s. These yield descriptive QPU execution-time ratios of 1.72x, 19.79x, 60.15x and 466.21x. The chi=256 to 512 curve change passes both selected refinement limits; the full convergence protocol is unfinished.",
  "scale": {
    "qubits": 80,
    "sites": 80
  },
  "quantum": {
    "backend": "IBM Kingston, Heron R2, IBM Runtime",
    "task": "Estimate the 31-point imbalance curve from t=0 to t=5 for the specified quasiperiodic XXZ chain",
    "workflow": "Completed job danusfv8gn2s739n5n3g used 31 N80 points and three N12 controls, 2048 shots per noise factor, TREX, twirling, XY4 and linear ZNE.",
    "timings": [
      {
        "seconds": 76.0,
        "scope": "Registered QPU usage for the completed full-curve IBM Kingston job; excludes queue, service overhead and local analysis",
        "primary": true
      },
      {
        "seconds": 66.928441088,
        "scope": "Provider circuit-execution field for the same completed job, not an end-to-end time",
        "primary": false
      }
    ],
    "result_summary": "The completed IBM job produced all 31 points with RMSE 0.036943 against the stated tensor-network mean. A later 40-second-capped quantum attempt failed and yielded no complete curve."
  },
  "classical_baselines": [
    {
      "method": "Local one-thread TEBD, chi=16, dt=1/6",
      "seconds": 8.012,
      "scope": "Median local execution across five complete 31-point confirmation runs",
      "status": "Rejected for converged-quality comparison: bond dimension capped at 16 from t=1/3, and the adjacent time-step refinement changed the curve by RMSE 0.024612 and maximum 0.064434, above the 0.005 and 0.01 stability limits"
    },
    {
      "method": "Local refined TEBD, chi=64, dt=1/24",
      "seconds": 130.689497672,
      "scope": "Local CPU execution for a more accurate 31-point curve; not end-to-end wall time",
      "status": "Rejected for converged-quality comparison: the finest chi and time-step refinements still exceeded the 0.005 RMSE and 0.01 maximum-change stability limits"
    },
    {
      "method": "Local one-thread TEBD, chi=128, dt=1/24",
      "seconds": 1503.989291496,
      "scope": "One complete local CPU execution for all 31 times through t=5; model preparation and process startup are separate",
      "status": "Rejected for convergence: relative to chi=64 at the same dt, the curve still changes by 0.00768883 RMS and 0.0215763 maximum, above the 0.005 and 0.01 limits. Accuracy versus the source-curve mean improved to 0.00638163 RMSE and 0.012272 maximum."
    },
    {
      "method": "Local one-thread TEBD, chi=256, dt=1/24",
      "seconds": 4571.539504329,
      "scope": "One complete local CPU execution for all 31 times through t=5; model preparation and process startup are separate",
      "status": "Relative to chi=128 at the same dt, the curve changes by 0.00447729 RMS (passes 0.005) and 0.0134847 maximum (fails 0.01). Accuracy versus the source-curve mean is 0.00513532 RMSE and 0.0107771 maximum. Time-step convergence at chi=256 was not tested."
    },
    {
      "method": "Local one-thread TEBD, chi=512, dt=1/24",
      "seconds": 35432.308620882,
      "scope": "One complete local CPU execution for all 31 times through t=5; one thread, cutoff 1e-10, model preparation and process startup separate",
      "status": "First chi refinement passing both limits: chi=256 to 512 changes 0.0026748081263094667 RMS and 0.006760126532773029 maximum, within 0.005 and 0.01. Source-mean RMSE 0.004542773006631673. Full convergence unfinished: a second consecutive passing chi refinement and a highest-chi time-step refinement are missing."
    },
    {
      "method": "Published H200 Pauli propagation",
      "seconds": 1673.49,
      "scope": "Separate upstream Heron R3 fixed-20 benchmark, not a measurement on this project's laptop",
      "status": "reported source comparison; cannot establish a local laptop speedup"
    }
  ],
  "comparison": {
    "classification": "local_execution_metric",
    "headline": "QPU usage of 76 s is shorter than local chi=512 TEBD execution (35,432.31 s) by 466.21x. The source-TN-mean RMSE improves from 0.00514 at chi=256 to 0.00454 at chi=512. The chi=256 to 512 curve change is 0.00267 RMS and 0.00676 at its largest point, within the chosen 0.005 and 0.01 limits. The preceding chi=128 to 256 maximum change failed its limit, and time-step convergence at chi=512 was not tested. This is a measured execution-time contrast, not a matched-quality quantum-advantage result.",
    "ratio": 466.2145871168685,
    "ratio_is_lower_bound": false,
    "scope": "The primary descriptive ratio is 35,432.308620882 seconds of local one-thread chi=512 TEBD execution divided by 76 seconds of provider QPU usage, or 466.21x. The chi=64, 128 and 256 contrasts are 1.72x, 19.79x and 60.15x. The first passing chi refinement does not finish the selected convergence protocol: a second consecutive passing chi refinement and highest-chi time-step refinement are missing. The source-TN mean is not an exact solution or an error certificate; quantum and classical errors and clock scopes are not matched.",
    "label": "Local execution-metric ratio; convergence unfinished"
  },
  "official_sources": [
    {
      "label": "Quantum Advantage Tracker issue 244",
      "url": "https://github.com/quantum-advantage-tracker/quantum-advantage-tracker.github.io/issues/244",
      "type": "tracker"
    },
    {
      "label": "Original XXZ implementation",
      "url": "https://github.com/ak2y/Imbalance_XXZ_hz_1D",
      "type": "repository"
    },
    {
      "label": "Measured chi=512 report and raw-data checkpoint (private)",
      "url": "https://github.com/BramDo/XXZham/blob/89f7bcfe55e670bd6d620753e998af4dcc9c0328/results/n80-chi512-20260926/report.md",
      "type": "data"
    }
  ],
  "implementation": {
    "edukaizen_url": "https://edukaizen.nl/xxzham-80-spins-nisq-quantum-computer/",
    "github_repositories": [
      "https://github.com/BramDo/XXZham"
    ],
    "key_articles": [
      "https://edukaizen.nl/xxzham-80-spins-nisq-quantum-computer/5-results/"
    ],
    "access_note": "The Edukaizen series is public. The complete project repository is private; full independent reproduction requires access permission."
  },
  "claim_boundary": [
    "The fast chi=16 timing is real: five complete runs reached all 31 times through t=5. It is excluded under the selected convergence gate because its coarse cap and time step fail refinement stability.",
    "Chi=128 improved the observable error and took 25 minutes 4 seconds on one local CPU thread. It still changed too much from chi=64, and time-step convergence at chi=128 was not measured. The chi=256 run took 76 minutes 12 seconds and had source-mean RMSE 0.00514; its chi=128 to 256 maximum change of 0.01348 failed the 0.01 limit. The completed chi=512 run took 9 hours 50 minutes 32 seconds, produced 31 finite points through t=5 and had source-mean RMSE 0.00454. Its chi=256 to 512 changes of 0.00267 RMS and 0.00676 maximum pass both limits. A second consecutive passing chi refinement and time-step refinement are still missing.",
    "The 76-second QPU usage and local CPU execution have different clock scopes. Queue, service overhead and local setup are not matched in this ratio.",
    "The reported 5.63x QPU/H200 ratio belongs to a different upstream Heron R3 benchmark, not the laptop comparison.",
    "The later frozen quantum trial had no successful complete result. These local measurements show an execution-metric lead over the named chi=64, chi=128, chi=256 and chi=512 TEBD settings, but do not yet establish matched-quality or end-to-end quantum advantage.",
    "The source reference is the average of the frozen TEBD and TDVP curves, not an exact solution or a certified error bound. The chi=512 raw-data SHA-256 is b300c3059a8d0b7fea3aba2097d3e3368df3b483cf03a5962506269e8c3358dd."
  ],
  "tags": [
    "xxz",
    "80-spins",
    "imbalance",
    "tebd",
    "ibm-kingston",
    "local-execution-metric"
  ]
}
